{
  "version": 2,
  "mode": "managed-agents",
  "last_updated": "2026-04-17T02:57:56.701Z",
  "route": {
    "request_id": "REQ-20260417-104845",
    "route_id": "F-M1",
    "task_type": "修复型",
    "flow_tier": "中流程",
    "current_phase": "complete",
    "next_expected_actor": "none",
    "blocked": false,
    "blocked_reason": ""
  },
  "required_manager_dispatch": [
    "planning-manager",
    "execution-manager",
    "acceptance-manager"
  ],
  "dispatched_managers": [
    "planning-manager",
    "execution-manager",
    "acceptance-manager"
  ],
  "required_capability_hands": [
    "shell-agent",
    "code-agent",
    "evidence-agent"
  ],
  "selected_capability_hands": [
    "shell-agent",
    "code-agent",
    "evidence-agent"
  ],
  "dispatched_capability_hands": [
    "shell-agent",
    "code-agent",
    "evidence-agent"
  ],
  "required_probes": [
    "regression-probe-agent",
    "artifact-probe-agent"
  ],
  "selected_probes": [
    "regression-probe-agent",
    "artifact-probe-agent"
  ],
  "dispatched_probes": [
    "regression-probe-agent",
    "artifact-probe-agent"
  ],
  "probe_requirements": {
    "default": {},
    "current": {
      "ui": false,
      "api": false,
      "regression": true,
      "artifact": true,
      "reason": "harness plugin route requirements"
    }
  },
  "acceptance": {
    "accepted_probe_producers": [
      "ui-probe-agent",
      "api-probe-agent",
      "regression-probe-agent",
      "artifact-probe-agent"
    ]
  }
}
